{
  "generated_at": "",
  "metric": "revenue",
  "dimension": "",
  "window_size": "5m",
  "current_windows": [
    {
      "window_start": "2026-04-01T10:00:00Z",
      "window_end": "2026-04-01T10:05:00Z",
      "summary": {
        "count": 4,
        "sum": 406.0,
        "min": 80.0,
        "max": 120.5,
        "average": 101.5,
        "median": 102.75,
        "variance": 252.1875,
        "std_dev": 15.8803,
        "p90": 118.0,
        "p95": 119.25,
        "first": 120.5,
        "last": 110.0,
        "delta": -10.5,
        "percent_change": -8.7137
      }
    },
    {
      "window_start": "2026-04-01T10:05:00Z",
      "window_end": "2026-04-01T10:10:00Z",
      "summary": {
        "count": 2,
        "sum": 350.0,
        "min": 150.0,
        "max": 200.0,
        "average": 175.0,
        "median": 175.0,
        "variance": 625.0,
        "std_dev": 25.0,
        "p90": 195.0,
        "p95": 197.5,
        "first": 200.0,
        "last": 150.0,
        "delta": -50.0,
        "percent_change": -25.0
      }
    }
  ],
  "previous_windows": [],
  "overall_summary": {
    "count": 6,
    "sum": 756.0,
    "min": 80.0,
    "max": 200.0,
    "average": 126.0,
    "median": 115.25,
    "variance": 1808.9167,
    "std_dev": 42.5314,
    "p90": 190.0,
    "p95": 195.0,
    "first": 120.5,
    "last": 150.0,
    "delta": 29.5,
    "percent_change": 24.4813
  },
  "trend": "up",
  "alerts": []
}
